<?xml version="1.0" encoding="UTF-8"?>
<!DOCTYPE imagenes SYSTEM "../dtd/imagenes.dtd">
<imagenes>
	<imagen>
		<enlace>
			<idPadre>gala</idPadre>
			<id>quienes_somos</id>
			<texto>Quen somos</texto>
			<href>#</href>
		</enlace>
		<img>/img/fotos/selva.png</img>
		<title>Quen somos</title>
		<alt>Quen somos</alt>
	</imagen>
	<imagen>
		<enlace>
			<idPadre>gala</idPadre>
			<id>donde_estamos</id>
			<texto>Onde estamos</texto>
			<href>#</href>
		</enlace>
		<img>/img/fotos/leo_peque.png</img>
		<title>Onde estamos</title>
		<alt>Onde estamos</alt>
	</imagen>
	<imagen>
		<enlace>
			<idPadre>gala</idPadre>
			<id>contacto</id>
			<texto>Contacto</texto>
			<href>#</href>
		</enlace>
		<img>/img/fotos/pico.png</img>
		<title>Contacto</title>
		<alt>Contacto</alt>
	</imagen>
	<imagen>
		<enlace>
			<idPadre>servicios</idPadre>
			<id>atencion_a_domicilio</id>
			<texto>Atención a domicilio</texto>
			<href>#</href>
		</enlace>
		<img>/img/fotos/conejo.png</img>
		<title>Atención a domicilio</title>
		<alt>Atención a domicilio</alt>
	</imagen>
	<imagen>
		<enlace>
			<idPadre>servicios</idPadre>
			<id>urgencias</id>
			<texto>Urxencias</texto>
			<href>#</href>
		</enlace>
		<img>/img/fotos/waldo.png</img>
		<title>Urxencias</title>
		<alt>Urxencias</alt>
	</imagen>
	<imagen>
		<enlace>
			<idPadre>servicios</idPadre>
			<id>peluqueria_canina</id>
			<texto>Perruquería canina</texto>
			<href>#</href>
		</enlace>
		<img>/img/fotos/toy.png</img>
		<title>Perruquería canina</title>
		<alt>Perruquería canina</alt>
	</imagen>
	<imagen>
		<enlace>
			<idPadre>servicios</idPadre>
			<id>atencion_de_animales_exoticos</id>
			<texto>Atención de animais exóticos.</texto>
			<href>#</href>
		</enlace>
		<img>/img/fotos/iguana.png</img>
		<title>Atención de animais exóticos.</title>
		<alt>Atención de animais exóticos.</alt>
	</imagen>
	<imagen>
		<enlace>
			<idPadre>servicios</idPadre>
			<id>sexaje_de_aves</id>
			<texto>Determinación de sexo en aves.</texto>
			<href>#</href>
		</enlace>
		<img>/img/fotos/periquitos.png</img>
		<title>Determinación de sexo en aves.</title>
		<alt>Determinación de sexo en aves.</alt>
	</imagen>
	<imagen>
		<enlace>
			<idPadre>servicios</idPadre>
			<id>tienda_especializada</id>
			<texto>Tenda especializada</texto>
			<href>#</href>
		</enlace>
		<img>/img/fotos/toby.png</img>
		<title>Tenda especializada</title>
		<alt>Tenda especializada</alt>
	</imagen>
	<imagen>
		<enlace>
			<idPadre>consejos</idPadre>
			<id>perros_y_gatos</id>
			<texto>Cans e gatos</texto>
			<href>#</href>
		</enlace>
		<img>/img/fotos/thor_y_zsazsa.png</img>
		<title>Cans e gatos</title>
		<alt>Cans e gatos</alt>
	</imagen>
	<imagen>
		<enlace>
			<idPadre>consejos</idPadre>
			<id>roedores</id>
			<texto>Roedores</texto>
			<href>#</href>
		</enlace>
		<img>/img/fotos/nera.png</img>
		<title>Roedores</title>
		<alt>Roedores</alt>
	</imagen>
	<imagen>
		<enlace>
			<idPadre>consejos</idPadre>
			<id>aves</id>
			<texto>Aves</texto>
			<href>#</href>
		</enlace>
		<img>/img/fotos/parrot_flickr.png</img>
		<title>Aves</title>
		<alt>Aves</alt>
	</imagen>
	<imagen>
		<enlace>
			<idPadre>consejos</idPadre>
			<id>reptiles</id>
			<texto>Reptiles</texto>
			<href>#</href>
		</enlace>
		<img>/img/fotos/tortuga_infopick.png</img>
		<title>Reptiles</title>
		<alt>Reptiles</alt>
	</imagen>
</imagenes>		